{
  "placeholder": false,
  "titles": {
    "monopoly": "State sanctioned monopoly!",
    "sponsor": "The Drunken Trials are back!",
    "lost": "Thomas Thatcher Sr. has a favorite brew...and its not yours.",
    "bankrupt": "Bankrupt"
  },
  "monopoly": [
    "Congratulations, {company} has been chosen as the official brewer, distiller and distributor for all alcoholic beverages in the entire isles!",
    "You have proven yourself as a true entrebrewneur and the isles thank you for your wonderful products!"
  ],
  "sponsor": [
    "The Drunken Trials are back after 51 long, dry years! Brought to you exclusively by {company}!",
    "“The only drink I'd trust to choose a king comes from {company}, that's for sure!”"
  ],
  "lost": [
    "The year is 463 and the Drunken Trials have been revived for the first time in 51 years! Thomas Thatcher Sr. has chosen {winner} as the exclusive sponsor of the event."
  ],
  "bankrupt": [
    "The creditors came knocking and took everything, even the last drop of brew is gone."
  ],
  "freeplayNote": "You did not win the sponsorship, so this run is not on the leaderboard. Freeplay continues past 463 unranked."
}
